<?xml version="1.0" encoding="UTF-8"?>
<portalLayout xmlns:xsi="http://www.w3.org/2001/XMLSchema-instance" xsi:noNamespaceSchemaLocation="portal-layout.xsd">
	<portalUser role="role_guest">		
		<portalTab>
			<title>tab.title.home</title>			
			<defaulted>true</defaulted>
			<closeable>false</closeable>
			<editable>false</editable>
			<moveable>false</moveable>
			<allowAddContent>false</allowAddContent>
			<widths>700,300</widths>
			<between>10</between>
			<portletWindow>WindowSkin2</portletWindow>			
			<portlets>
				<portlet>
					<name>infoPortlet</name>
					<column>0</column>
					<row>0</row>
					<notCloseable>true</notCloseable>
					<noEditMode>true</noEditMode>
					<noConfigMode>true</noConfigMode>					
				</portlet>
				
			    <portlet>
					<name>loginPortlet</name>
					<column>1</column>
					<row>0</row>
					<notCloseable>true</notCloseable>
					<noEditMode>true</noEditMode>
					<noConfigMode>true</noConfigMode>
				</portlet>																													
			</portlets>
		</portalTab>	
	</portalUser>
	
	<portalUser role="role_user">
		<portalTab>
		   <title>tab.title.personal</title>   
		   <defaulted>true</defaulted>
		   <closeable>false</closeable>
		   <editable>true</editable>
		   <moveable>true</moveable>
		   <allowAddContent>true</allowAddContent>
		   <widths>300,700</widths>
		   <between>10</between>
		   <portletWindow>WindowSkin2</portletWindow>   
		   <portlets>
			    <portlet>
			     <name>profilePortlet</name>
			     <column>0</column>
			     <row>0</row>
			    </portlet> 	  	    		
			    <portlet>
			     <name>myMessagePortlet</name>
			     <column>0</column>
			     <row>1</row>
			    </portlet>        
		        <portlet>        
			     <name>friendsPortlet</name>
			     <column>0</column>
			     <row>2</row>
		    	</portlet> 		    	       
			    <portlet>
					<name>microblogAddPortlet</name>
					<column>1</column>
					<row>0</row>
				</portlet>		
				<portlet>
			     <name>microblogPortlet</name>
			     <column>1</column>
			     <row>1</row>
			    </portlet> 
			</portlets>	 	    
	  	</portalTab>	   
	</portalUser>
	
		<portalUser role="role_noprofile">
	  	<portalTab>
		   <title>tab.title.profile</title>   
		   <defaulted>true</defaulted>
		   <closeable>false</closeable>
		   <editable>false</editable>
		   <moveable>false</moveable>
		   <allowAddContent>false</allowAddContent>
		   <widths>300,700</widths>
		   <between>10</between>
		   <portletWindow>WindowSkin2</portletWindow>   
		   <portlets>
			    <portlet>
			     <name>profilePortlet</name>
			     <column>0</column>
			     <row>0</row>
			    </portlet> 	  	
			    <portlet>
			     <name>myContactPortlet</name>
			     <column>0</column>
			     <row>1</row>
			    </portlet> 		    		
		   </portlets>	 	    
	  </portalTab>    	
	</portalUser>	
	<portalUser role="role_profile">
	  	<portalTab>
		   <title>tab.title.profile</title>   
		   <defaulted>true</defaulted>
		   <closeable>false</closeable>
		   <editable>false</editable>
		   <moveable>false</moveable>
		   <allowAddContent>false</allowAddContent>
		   <widths>300,700</widths>
		   <between>10</between>
		   <portletWindow>WindowSkin2</portletWindow>   
		   	<portlets>
			    <portlet>
			     <name>profilePortlet</name>
			     <column>0</column>
			     <row>0</row>
			    </portlet> 	  	    		
			    <portlet>
			     <name>myBlurbPortlet</name>
			     <column>0</column>
			     <row>1</row>
			    </portlet>        
		        <portlet>        
			     <name>friendsPortlet</name>
			     <column>0</column>
			     <row>2</row>
			    </portlet> 
			    <portlet>
			     <name>myContactPortlet</name>
			     <column>0</column>
			     <row>3</row>
			    </portlet> 		 	        
			    <portlet>
					<name>microblogAddPortlet</name>
					<column>1</column>
					<row>0</row>
				</portlet>		
				<portlet>
			     <name>microblogPortlet</name>
			     <column>1</column>
			     <row>1</row>
			    </portlet> 
		   	</portlets>	 	   
		  </portalTab>    	
	</portalUser>	
	
	<portalUser role="role_group">
	  <portalTab>
	   <title>tab.title.group</title>   
	   <defaulted>true</defaulted>
	   <closeable>true</closeable>
	   <editable>true</editable>
	   <moveable>true</moveable>
	   <allowAddContent>true</allowAddContent>
	   <widths>300,400,240</widths>
	   <between>10</between>
	   <portletWindow>WindowSkin2</portletWindow>   
	   <portlets>
	    <portlet>
	     <name>groupProfilePortlet</name>
	     <column>0</column>
	     <row>0</row>
	     <notCloseable>true</notCloseable>
	    </portlet> 	  	 
	    <portlet>
	     <name>activityPortlet</name>
	     <column>1</column>
	     <row>0</row>
	     <notCloseable>true</notCloseable>
	    </portlet> 
	    <portlet>
	     <name>groupMembersPortlet</name>
	     <column>2</column>
	     <row>0</row>
	     <notCloseable>true</notCloseable>
	    </portlet> 	     
	   </portlets>
	  </portalTab>  
	  <portalTab>
	   <title>tab.title.members</title>   
	   <defaulted>true</defaulted>
	   <closeable>true</closeable>
	   <editable>true</editable>
	   <moveable>true</moveable>
	   <allowAddContent>true</allowAddContent>
	   <widths>1000</widths>
	   <between>10</between>
	   <portletWindow>WindowSkin2</portletWindow>   
	   <portlets>
	    <portlet>
	     <name>groupMembersPortlet</name>
	     <column>0</column>
	     <row>0</row>
	     <notCloseable>true</notCloseable>
	    </portlet> 	  
	   </portlets>
	  </portalTab>  
	  <portalTab>
	   <title>tab.title.photos</title>   
	   <defaulted>true</defaulted>
	   <closeable>false</closeable>
	   <editable>false</editable>
	   <moveable>false</moveable>
	   <allowAddContent>false</allowAddContent>
	   <widths>1000</widths>
	   <between>10</between>
	   <portletWindow>WindowSkin2</portletWindow>   
	   <portlets>
	    <portlet>
	     <name>groupPicturePortlet</name>
	     <column>0</column>
	     <row>0</row>
	     <notCloseable>true</notCloseable>
	    </portlet> 	  
	   </portlets>
	  </portalTab> 
	  <portalTab>
	   <title>tab.title.blog</title>   
	   <defaulted>true</defaulted>
	   <closeable>true</closeable>
	   <editable>true</editable>
	   <moveable>true</moveable>
	   <allowAddContent>true</allowAddContent>
	   <widths>1000</widths>
	   <between>10</between>
	   <portletWindow>WindowSkin2</portletWindow>   
	   <portlets>
	    <portlet>
	     <name>blogGroupPortlet</name>
	     <column>0</column>
	     <row>0</row>
	     <notCloseable>true</notCloseable>
	    </portlet> 	       
	   </portlets>
	  </portalTab> 
	  <portalTab>
	   <title>tab.title.forum</title>   
	   <defaulted>true</defaulted>
	   <closeable>true</closeable>
	   <editable>true</editable>
	   <moveable>true</moveable>
	   <allowAddContent>true</allowAddContent>
	   <widths>1000</widths>
	   <between>10</between>
	   <portletWindow>WindowSkin2</portletWindow>   
	   <portlets>
	    <portlet>
	     <name>forumPortlet</name>
	     <column>0</column>
	     <row>0</row>
	     <notCloseable>true</notCloseable>
	    </portlet> 	       
	   </portlets>
	  </portalTab> 
	  <portalTab>
	   <title>tab.title.bulletin</title>   
	   <defaulted>true</defaulted>
	   <closeable>true</closeable>
	   <editable>true</editable>
	   <moveable>true</moveable>
	   <allowAddContent>true</allowAddContent>
	   <widths>1000</widths>
	   <between>10</between>
	   <portletWindow>WindowSkin2</portletWindow>   
	   <portlets>	     
	    <portlet>
	     <name>bulletinPortlet</name>
	     <column>0</column>
	     <row>1</row>
	     <notCloseable>true</notCloseable>
	    </portlet> 	          
	   </portlets>
	  </portalTab>	        	  	
	</portalUser>		
	<portalUser role="role_admin">
	  <portalTab>
	   <title>Admin</title>   
	   <defaulted>false</defaulted>
	   <closeable>false</closeable>
	   <editable>true</editable>
	   <moveable>true</moveable>
	   <allowAddContent>true</allowAddContent>
	   <widths>400,600</widths>
	   <between>10</between>
	   <portletWindow>WindowSkin2</portletWindow>   
	   <portlets>	    
	    <portlet>
	     <name>indexerPortlet</name>
	     <column>0</column>
	     <row>0</row>
	     <notCloseable>true</notCloseable>
	    </portlet>
	    <portlet>
			<name>internalNewsPortlet</name>
			<column>0</column>
			<row>1</row>
			<notCloseable>true</notCloseable>					
		</portlet>	 	      	 
	    <portlet>
	     <name>organizationPortlet</name>
	     <column>1</column>
	     <row>0</row>
	     <notCloseable>true</notCloseable>
	    </portlet> 
	    <portlet>
	     <name>userManagePortlet</name>
	     <column>1</column>
	     <row>1</row>
	     <notCloseable>true</notCloseable>
	    </portlet>	    
	   </portlets>	   
	  </portalTab>    	
	</portalUser>	
	<portalUser role="channel_forum">
		<portalTab>
			<title>tab.title.forum</title>			
			<defaulted>false</defaulted>
			<closeable>false</closeable>
			<editable>false</editable>
			<moveable>false</moveable>
			<allowAddContent>false</allowAddContent>
			<widths>1000</widths>
			<between>10</between>
			<portletWindow>WindowSkin2</portletWindow>
			<portlets>
				<portlet>
					<name>forumPortlet</name>
					<column>0</column>
					<row>0</row>
					<notCloseable>true</notCloseable>
					<noEditMode>true</noEditMode>
					<noConfigMode>true</noConfigMode>
				</portlet>	
			</portlets>
		</portalTab>
	</portalUser>
	<portalUser role="channel_blog">
		<portalTab>
			<title>tab.title.blog</title>			
			<defaulted>false</defaulted>
			<closeable>false</closeable>
			<editable>false</editable>
			<moveable>false</moveable>
			<allowAddContent>false</allowAddContent>
			<widths>1000</widths>
			<between>10</between>
			<portletWindow>WindowSkin1</portletWindow>